{
  "description": {
    "ar": "يكون الفرد منهم مرهقًا ومن المحتمل أن تكون تفاعلاته مع الأتباع الآخرين سلبية.",
    "de": "Ist erschöpft und hat mit einer hohen Wahrscheinlichkeit negative Interaktionen mit anderen Anhängern.",
    "en": "Exhausted and likely to have negative interactions with other Followers.",
    "es": "El cansancio hace que interactúe de mala manera con otros adeptos.",
    "fr": "Manque de repos et risque d'avoir des interactions négatives avec les autres adeptes.",
    "fr-CA": "Manque de repos et risque d'avoir des interactions négatives avec les autres adeptes.",
    "it": "È allo stremo, tanto che avrà quasi certamente interazioni negative con gli altri membri del Culto.",
    "ja": "子育ての疲れにより、ほかの信者とのコミュニケーションがネガティブなものになりやすい",
    "ko": "지쳐서 다른 추종자와 부정적인 상호작용을 할 가능성이 높습니다.",
    "nl": "Uitgeput en grote kans om negatieve interacties te hebben met andere volgelingen.",
    "pt-BR": "Está com exaustão e tende a interagir negativamente com outros Seguidores.",
    "ru": "Последователь находится на пределе сил и может отрицательно влиять на других.",
    "tr": "Bitkin düşmüş bir ebeveyn. Diğer Takipçilerle olumsuz etkileşime girme ihtimali artar.",
    "zh-CN": "觉得疲惫，有可能与其他教徒负面互动。",
    "zh-TW": "覺得疲憊，有可能與其他教徒負面互動。"
  },
  "descriptionPlain": {
    "ar": "يكون الفرد منهم مرهقًا ومن المحتمل أن تكون تفاعلاته مع الأتباع الآخرين سلبية.",
    "de": "Ist erschöpft und hat mit einer hohen Wahrscheinlichkeit negative Interaktionen mit anderen Anhängern.",
    "en": "Exhausted and likely to have negative interactions with other Followers.",
    "es": "El cansancio hace que interactúe de mala manera con otros adeptos.",
    "fr": "Manque de repos et risque d'avoir des interactions négatives avec les autres adeptes.",
    "fr-CA": "Manque de repos et risque d'avoir des interactions négatives avec les autres adeptes.",
    "it": "È allo stremo, tanto che avrà quasi certamente interazioni negative con gli altri membri del Culto.",
    "ja": "子育ての疲れにより、ほかの信者とのコミュニケーションがネガティブなものになりやすい",
    "ko": "지쳐서 다른 추종자와 부정적인 상호작용을 할 가능성이 높습니다.",
    "nl": "Uitgeput en grote kans om negatieve interacties te hebben met andere volgelingen.",
    "pt-BR": "Está com exaustão e tende a interagir negativamente com outros Seguidores.",
    "ru": "Последователь находится на пределе сил и может отрицательно влиять на других.",
    "tr": "Bitkin düşmüş bir ebeveyn. Diğer Takipçilerle olumsuz etkileşime girme ihtimali artar.",
    "zh-CN": "觉得疲惫，有可能与其他教徒负面互动。",
    "zh-TW": "覺得疲憊，有可能與其他教徒負面互動。"
  },
  "exclusiveWith": "ProudParent",
  "groups": [
    "excludedFromMating"
  ],
  "icon": "icons/traits/OverworkedParent.png",
  "id": "OverworkedParent",
  "name": {
    "ar": "الآباء المنهكون",
    "de": "Überwältigter Elternteil",
    "en": "Overwhelmed Parent",
    "es": "Padre abrumado",
    "fr": "Parentalité difficile",
    "fr-CA": "Parentalité difficile",
    "it": "Genitorialità sopraffatta",
    "ja": "疲れ果てた親",
    "ko": "지친 부모",
    "nl": "Overweldigde ouder",
    "pt-BR": "Esgotado pelo Filho",
    "ru": "Родительская усталость",
    "tr": "Bunalmış Ebeveyn",
    "zh-CN": "育儿负担沉重",
    "zh-TW": "育兒負擔沉重"
  },
  "namePlain": {
    "ar": "الآباء المنهكون",
    "de": "Überwältigter Elternteil",
    "en": "Overwhelmed Parent",
    "es": "Padre abrumado",
    "fr": "Parentalité difficile",
    "fr-CA": "Parentalité difficile",
    "it": "Genitorialità sopraffatta",
    "ja": "疲れ果てた親",
    "ko": "지친 부모",
    "nl": "Overweldigde ouder",
    "pt-BR": "Esgotado pelo Filho",
    "ru": "Родительская усталость",
    "tr": "Bunalmış Ebeveyn",
    "zh-CN": "育儿负担沉重",
    "zh-TW": "育兒負擔沉重"
  },
  "positive": false,
  "thumb": "icons/traits/64/OverworkedParent.png"
}
