{
  "description": {
    "ar": "ينام الفرد طوال الصيف.",
    "de": "Der Anhänger schläft den ganzen Sommer über.",
    "en": "Sleeps all summer.",
    "es": "Se pasa todo el verano durmiendo.",
    "fr": "Dort tout l'été.",
    "fr-CA": "Dort tout l'été.",
    "it": "Dorme tutta l'estate.",
    "ja": "夏の間、ずっと寝続ける",
    "ko": "여름 내내 잠만 잡니다.",
    "nl": "Slaapt de hele zomer.",
    "pt-BR": "Dorme o verão inteiro.",
    "ru": "Последователь спит на протяжении всего лета.",
    "tr": "Bütün yaz uyur.",
    "zh-CN": "夏天时会沉睡。",
    "zh-TW": "夏天時會沉睡。"
  },
  "descriptionPlain": {
    "ar": "ينام الفرد طوال الصيف.",
    "de": "Der Anhänger schläft den ganzen Sommer über.",
    "en": "Sleeps all summer.",
    "es": "Se pasa todo el verano durmiendo.",
    "fr": "Dort tout l'été.",
    "fr-CA": "Dort tout l'été.",
    "it": "Dorme tutta l'estate.",
    "ja": "夏の間、ずっと寝続ける",
    "ko": "여름 내내 잠만 잡니다.",
    "nl": "Slaapt de hele zomer.",
    "pt-BR": "Dorme o verão inteiro.",
    "ru": "Последователь спит на протяжении всего лета.",
    "tr": "Bütün yaz uyur.",
    "zh-CN": "夏天时会沉睡。",
    "zh-TW": "夏天時會沉睡。"
  },
  "exclusiveWith": "Hibernation",
  "groups": [
    "starting",
    "single",
    "majorDlc",
    "winter"
  ],
  "icon": "icons/traits/Aestivation.png",
  "id": "Aestivation",
  "name": {
    "ar": "السبات الصيفي",
    "de": "Sommerschlaf",
    "en": "Aestivation",
    "es": "Estivación",
    "fr": "Estivation",
    "fr-CA": "Estivation",
    "it": "Estivazione",
    "ja": "夏眠",
    "ko": "여름잠",
    "nl": "Zomerslaap",
    "pt-BR": "Estivação",
    "ru": "Необходимость летней спячки",
    "tr": "Yaz Uykusu",
    "zh-CN": "夏眠",
    "zh-TW": "夏眠"
  },
  "namePlain": {
    "ar": "السبات الصيفي",
    "de": "Sommerschlaf",
    "en": "Aestivation",
    "es": "Estivación",
    "fr": "Estivation",
    "fr-CA": "Estivation",
    "it": "Estivazione",
    "ja": "夏眠",
    "ko": "여름잠",
    "nl": "Zomerslaap",
    "pt-BR": "Estivação",
    "ru": "Необходимость летней спячки",
    "tr": "Yaz Uykusu",
    "zh-CN": "夏眠",
    "zh-TW": "夏眠"
  },
  "positive": false,
  "thumb": "icons/traits/64/Aestivation.png"
}
