{
  "description": {
    "ar": "ينام الفرد في ظل أي ظروف حتى مع صوت الغطيط.",
    "de": "Der Anhänger schläft bei fast allem durch, sogar bei Schnarchern.",
    "en": "Will sleep through almost anything, even Snorers.",
    "es": "Duerme como un tronco, incluso aunque oiga ronquidos.",
    "fr": "Rien ne réveillera cet adepte la nuit, pas même les ronflements des adeptes au sommeil bruyant.",
    "fr-CA": "Rien ne réveillera cet adepte la nuit, pas même les ronflements des adeptes au sommeil bruyant.",
    "it": "Dormirà in qualunque situazione, anche in mezzo a chi russa.",
    "ja": "いびきなどを気にせず寝続ける",
    "ko": "주변에 아무 신경도 안 쓰고 깊게 잠듭니다. 코골이도 문제 없습니다.",
    "nl": "Slaapt door bijna alles heen, zelfs gesnurk.",
    "pt-BR": "Consegue dormir em qualquer condição, até perto de quem ronca alto.",
    "ru": "Последователь не просыпается даже от храпа.",
    "tr": "Neredeyse hiçbir şey uykusunu bölemez, Horlayan Uykucular bile.",
    "zh-CN": "几乎任何时候都可以一觉不醒，哪怕身旁有打鼾者。",
    "zh-TW": "幾乎一覺不醒，哪怕身旁有打鼾者。"
  },
  "descriptionPlain": {
    "ar": "ينام الفرد في ظل أي ظروف حتى مع صوت الغطيط.",
    "de": "Der Anhänger schläft bei fast allem durch, sogar bei Schnarchern.",
    "en": "Will sleep through almost anything, even Snorers.",
    "es": "Duerme como un tronco, incluso aunque oiga ronquidos.",
    "fr": "Rien ne réveillera cet adepte la nuit, pas même les ronflements des adeptes au sommeil bruyant.",
    "fr-CA": "Rien ne réveillera cet adepte la nuit, pas même les ronflements des adeptes au sommeil bruyant.",
    "it": "Dormirà in qualunque situazione, anche in mezzo a chi russa.",
    "ja": "いびきなどを気にせず寝続ける",
    "ko": "주변에 아무 신경도 안 쓰고 깊게 잠듭니다. 코골이도 문제 없습니다.",
    "nl": "Slaapt door bijna alles heen, zelfs gesnurk.",
    "pt-BR": "Consegue dormir em qualquer condição, até perto de quem ronca alto.",
    "ru": "Последователь не просыпается даже от храпа.",
    "tr": "Neredeyse hiçbir şey uykusunu bölemez, Horlayan Uykucular bile.",
    "zh-CN": "几乎任何时候都可以一觉不醒，哪怕身旁有打鼾者。",
    "zh-TW": "幾乎一覺不醒，哪怕身旁有打鼾者。"
  },
  "exclusiveWith": null,
  "groups": [
    "starting",
    "good",
    "majorDlc"
  ],
  "icon": "icons/traits/DeepSleeper.png",
  "id": "DeepSleeper",
  "name": {
    "ar": "النوم العميق",
    "de": "Tiefschläfer",
    "en": "Deep Sleeper",
    "es": "Lirón",
    "fr": "Sommeil profond",
    "fr-CA": "Sommeil profond",
    "it": "Sonno pesante",
    "ja": "爆睡",
    "ko": "숙면가",
    "nl": "Diepe slaper",
    "pt-BR": "Sono Profundo",
    "ru": "Глубокий сон",
    "tr": "Derin Uykucu",
    "zh-CN": "深度睡眠者",
    "zh-TW": "深度睡眠者"
  },
  "namePlain": {
    "ar": "النوم العميق",
    "de": "Tiefschläfer",
    "en": "Deep Sleeper",
    "es": "Lirón",
    "fr": "Sommeil profond",
    "fr-CA": "Sommeil profond",
    "it": "Sonno pesante",
    "ja": "爆睡",
    "ko": "숙면가",
    "nl": "Diepe slaper",
    "pt-BR": "Sono Profundo",
    "ru": "Глубокий сон",
    "tr": "Derin Uykucu",
    "zh-CN": "深度睡眠者",
    "zh-TW": "深度睡眠者"
  },
  "positive": true,
  "thumb": "icons/traits/64/DeepSleeper.png"
}
