{
  "description": {
    "ar": "<sprite name=\"icon_FaithDown\">فرد... لا يتودد كثيرًا للأتباع الآخرين.",
    "de": "<sprite name=\"icon_FaithDown\">Zeigt sich anderen Anhängern gegenüber nicht sehr ... zugeneigt.",
    "en": "<sprite name=\"icon_FaithDown\"> Not very... affectionate towards other Followers.",
    "es": "<sprite name=\"icon_FaithDown\"> No les da muchos arrumacos a otros adeptos.",
    "fr": "<sprite name=\"icon_FaithDown\"> Préfère garder ses distances avec les adeptes célibataires.",
    "fr-CA": "<sprite name=\"icon_FaithDown\"> Préfère garder ses distances avec les adeptes célibataires.",
    "it": "<sprite name=\"icon_FaithDown\"> Non nutre particolare \"affetto\" per gli altri membri del Culto.",
    "ja": "<sprite name=\"icon_FaithDown\"> ほかの信者をあまり好きにならない",
    "ko": "<sprite name=\"icon_FaithDown\"> 다른 추종자에게 별로... 애정을 갈구하지 않습니다.",
    "nl": "<sprite name=\"icon_FaithDown\">Niet erg... aanhankelijk richting andere volgelingen.",
    "pt-BR": "<sprite name=\"icon_FaithDown\">Não têm muito \"afeto\" por outros Seguidores.",
    "ru": "<sprite name=\"icon_FaithDown\"> Последователь ведёт себя очень… сдержанно по отношению к другим.",
    "tr": "<sprite name=\"icon_FaithDown\"> Diğer Takipçilere karşı pek... istekli değildir.",
    "zh-CN": "<sprite name=\"icon_FaithDown\"> 对其他教徒没那么……热情。",
    "zh-TW": "<sprite name=\"icon_FaithDown\"> 對其他教徒沒那麼……熱情。"
  },
  "descriptionPlain": {
    "ar": "فرد... لا يتودد كثيرًا للأتباع الآخرين.",
    "de": "Zeigt sich anderen Anhängern gegenüber nicht sehr... zugeneigt.",
    "en": "Not very... affectionate towards other Followers.",
    "es": "No les da muchos arrumacos a otros adeptos.",
    "fr": "Préfère garder ses distances avec les adeptes célibataires.",
    "fr-CA": "Préfère garder ses distances avec les adeptes célibataires.",
    "it": "Non nutre particolare \"affetto\" per gli altri membri del Culto.",
    "ja": "ほかの信者をあまり好きにならない",
    "ko": "다른 추종자에게 별로... 애정을 갈구하지 않습니다.",
    "nl": "Niet erg... aanhankelijk richting andere volgelingen.",
    "pt-BR": "Não têm muito \"afeto\" por outros Seguidores.",
    "ru": "Последователь ведёт себя очень… сдержанно по отношению к другим.",
    "tr": "Diğer Takipçilere karşı pek... istekli değildir.",
    "zh-CN": "对其他教徒没那么……热情。",
    "zh-TW": "對其他教徒沒那麼……熱情。"
  },
  "exclusiveWith": "Lustful",
  "groups": [
    "starting",
    "sin"
  ],
  "icon": "icons/traits/Celibate.png",
  "id": "Celibate",
  "name": {
    "ar": "التعفف",
    "de": "Keusch",
    "en": "Celibate",
    "es": "Celibato",
    "fr": "Chasteté",
    "fr-CA": "Chasteté",
    "it": "Castità",
    "ja": "独身主義",
    "ko": "독신주의자",
    "nl": "Celibatair",
    "pt-BR": "Celibato",
    "ru": "Воздержание",
    "tr": "Gönülsüz",
    "zh-CN": "反欲",
    "zh-TW": "反慾"
  },
  "namePlain": {
    "ar": "التعفف",
    "de": "Keusch",
    "en": "Celibate",
    "es": "Celibato",
    "fr": "Chasteté",
    "fr-CA": "Chasteté",
    "it": "Castità",
    "ja": "独身主義",
    "ko": "독신주의자",
    "nl": "Celibatair",
    "pt-BR": "Celibato",
    "ru": "Воздержание",
    "tr": "Gönülsüz",
    "zh-CN": "反欲",
    "zh-TW": "反慾"
  },
  "positive": false,
  "thumb": "icons/traits/64/Celibate.png"
}
