{
  "description": {
    "ar": "فرد ينظِم قصائد بدلًا من العمل.",
    "de": "Schreibt Gedichte, statt zu arbeiten.",
    "en": "Writes poems instead of working.",
    "es": "Escribe poemas en vez de trabajar.",
    "fr": "Écrit des poèmes au lieu de travailler.",
    "fr-CA": "Écrit des poèmes au lieu de travailler.",
    "it": "Scrive poesie al posto di lavorare.",
    "ja": "作業をするかわりに詩を書く",
    "ko": "일을 하는 대신 시를 씁니다.",
    "nl": "Schrijft poëzie in plaats van te werken.",
    "pt-BR": "Escreve poemas em vez de trabalhar.",
    "ru": "Последователь пишет стихи вместо работы.",
    "tr": "Çalışmak yerine şiir yazar.",
    "zh-CN": "会写诗，不工作。",
    "zh-TW": "會寫詩，不工作。"
  },
  "descriptionPlain": {
    "ar": "فرد ينظِم قصائد بدلًا من العمل.",
    "de": "Schreibt Gedichte, statt zu arbeiten.",
    "en": "Writes poems instead of working.",
    "es": "Escribe poemas en vez de trabajar.",
    "fr": "Écrit des poèmes au lieu de travailler.",
    "fr-CA": "Écrit des poèmes au lieu de travailler.",
    "it": "Scrive poesie al posto di lavorare.",
    "ja": "作業をするかわりに詩を書く",
    "ko": "일을 하는 대신 시를 씁니다.",
    "nl": "Schrijft poëzie in plaats van te werken.",
    "pt-BR": "Escreve poemas em vez de trabalhar.",
    "ru": "Последователь пишет стихи вместо работы.",
    "tr": "Çalışmak yerine şiir yazar.",
    "zh-CN": "会写诗，不工作。",
    "zh-TW": "會寫詩，不工作。"
  },
  "exclusiveWith": null,
  "groups": [
    "rareStarting",
    "single"
  ],
  "icon": "icons/traits/Poet.png",
  "id": "Poet",
  "name": {
    "ar": "الشاعر",
    "de": "Poet",
    "en": "Poet",
    "es": "Poeta",
    "fr": "Poésie",
    "fr-CA": "Poésie",
    "it": "Poesia",
    "ja": "詩人",
    "ko": "시인",
    "nl": "Dichter",
    "pt-BR": "Poeta",
    "ru": "Поэтический дар",
    "tr": "Şair",
    "zh-CN": "诗人",
    "zh-TW": "詩人"
  },
  "namePlain": {
    "ar": "الشاعر",
    "de": "Poet",
    "en": "Poet",
    "es": "Poeta",
    "fr": "Poésie",
    "fr-CA": "Poésie",
    "it": "Poesia",
    "ja": "詩人",
    "ko": "시인",
    "nl": "Dichter",
    "pt-BR": "Poeta",
    "ru": "Поэтический дар",
    "tr": "Şair",
    "zh-CN": "诗人",
    "zh-TW": "詩人"
  },
  "positive": false,
  "thumb": "icons/traits/64/Poet.png"
}
