{
  "description": {
    "ar": "سيتلقى أحد أحفاد هذا التابع سمة \"الصغير المختار\".",
    "de": "Der Enkel dieses Anhängers erhält die Eigenschaft „Auserwähltes Kind“.",
    "en": "The grandchild of this Follower will receive the 'Chosen Child' trait.",
    "es": "El nieto de este adepto recibirá el rasgo Elegido.",
    "fr": "Le petit-enfant de cet adepte recevra la croyance « Enfant élu ».",
    "fr-CA": "Le petit-enfant de cet adepte recevra la croyance « Enfant élu ».",
    "it": "I suoi nipoti riceveranno il tratto Discendenza eletta.",
    "ja": "この信者の孫は、特性「選ばれし子」を得る",
    "ko": "이 추종자의 손자는 '선택받은 아이' 특성을 획득합니다.",
    "nl": "Het kleinkind van deze volgeling ontvangt de eigenschap 'Uitverkoren kind'.",
    "pt-BR": "O neto deste Seguidor recebe o aspecto \"Criança Escolhida\".",
    "ru": "Последователь передаст своему внуку особенность «Благословенное чадо».",
    "tr": "Bu Takipçi'nin torunu \"Seçilmiş Çocuk\" özelliğine sahip olur.",
    "zh-CN": "这名教徒的孙辈将获得「天选之子」特质。",
    "zh-TW": "這名教徒的孫輩將獲得「獲選之子」特質。"
  },
  "descriptionPlain": {
    "ar": "سيتلقى أحد أحفاد هذا التابع سمة \"الصغير المختار\".",
    "de": "Der Enkel dieses Anhängers erhält die Eigenschaft „Auserwähltes Kind“.",
    "en": "The grandchild of this Follower will receive the 'Chosen Child' trait.",
    "es": "El nieto de este adepto recibirá el rasgo Elegido.",
    "fr": "Le petit-enfant de cet adepte recevra la croyance « Enfant élu ».",
    "fr-CA": "Le petit-enfant de cet adepte recevra la croyance « Enfant élu ».",
    "it": "I suoi nipoti riceveranno il tratto Discendenza eletta.",
    "ja": "この信者の孫は、特性「選ばれし子」を得る",
    "ko": "이 추종자의 손자는 '선택받은 아이' 특성을 획득합니다.",
    "nl": "Het kleinkind van deze volgeling ontvangt de eigenschap 'Uitverkoren kind'.",
    "pt-BR": "O neto deste Seguidor recebe o aspecto \"Criança Escolhida\".",
    "ru": "Последователь передаст своему внуку особенность «Благословенное чадо».",
    "tr": "Bu Takipçi'nin torunu \"Seçilmiş Çocuk\" özelliğine sahip olur.",
    "zh-CN": "这名教徒的孙辈将获得「天选之子」特质。",
    "zh-TW": "這名教徒的孫輩將獲得「獲選之子」特質。"
  },
  "exclusiveWith": null,
  "groups": [
    "good",
    "majorDlc",
    "pureBlood"
  ],
  "icon": "icons/traits/PureBlood_2.png",
  "id": "PureBlood_2",
  "name": {
    "ar": "النسل II",
    "de": "Vererbung II",
    "en": "Pedigree II",
    "es": "Linaje II",
    "fr": "Pedigree II",
    "fr-CA": "Pedigree II",
    "it": "Pedigree II",
    "ja": "純粋なる血統 II",
    "ko": "선민 II",
    "nl": "Stamboom II",
    "pt-BR": "Pedigree II",
    "ru": "Родословная II",
    "tr": "Asil Soy II",
    "zh-CN": "血统 II",
    "zh-TW": "血統 II"
  },
  "namePlain": {
    "ar": "النسل II",
    "de": "Vererbung II",
    "en": "Pedigree II",
    "es": "Linaje II",
    "fr": "Pedigree II",
    "fr-CA": "Pedigree II",
    "it": "Pedigree II",
    "ja": "純粋なる血統 II",
    "ko": "선민 II",
    "nl": "Stamboom II",
    "pt-BR": "Pedigree II",
    "ru": "Родословная II",
    "tr": "Asil Soy II",
    "zh-CN": "血统 II",
    "zh-TW": "血統 II"
  },
  "positive": true,
  "thumb": "icons/traits/64/PureBlood_2.png"
}
