{
  "description": {
    "ar": "يغضب الفرد بعد الطلاق ولا ينفذ ما يُملى عليه.",
    "de": "Der Anhänger ist nach der Scheidung wütend. Er lässt sich nicht sagen, was er tun soll.",
    "en": "Angry after the divorce. Will not be told what to do.",
    "es": "El divorcio le ha puesto de mala leche. No deja que nadie le diga qué hacer.",
    "fr": "En colère après le divorce. N'écoutera pas les ordres.",
    "fr-CA": "En colère après le divorce. N'écoutera pas les ordres.",
    "it": "È così furente per il divorzio che non risponderà agli ordini.",
    "ja": "離婚を根に持っており、言うことを聞かない",
    "ko": "이별로 인해 화가 단단히 났습니다. 지시에 따르지 않을 것입니다.",
    "nl": "Boos na de scheiding. Gehoorzaamt geen werkopdrachten meer.",
    "pt-BR": "Sentirá raiva após o divórcio. Não quer saber de seguir ordens.",
    "ru": "Последователь тяжело переживает развод, поэтому не слушает приказов.",
    "tr": "Boşanmadan dolayı sinirli. Emirlere uymaz.",
    "zh-CN": "离婚后变得易怒，不会听从命令。",
    "zh-TW": "離婚後變得易怒，不會聽從命令。"
  },
  "descriptionPlain": {
    "ar": "يغضب الفرد بعد الطلاق ولا ينفذ ما يُملى عليه.",
    "de": "Der Anhänger ist nach der Scheidung wütend. Er lässt sich nicht sagen, was er tun soll.",
    "en": "Angry after the divorce. Will not be told what to do.",
    "es": "El divorcio le ha puesto de mala leche. No deja que nadie le diga qué hacer.",
    "fr": "En colère après le divorce. N'écoutera pas les ordres.",
    "fr-CA": "En colère après le divorce. N'écoutera pas les ordres.",
    "it": "È così furente per il divorzio che non risponderà agli ordini.",
    "ja": "離婚を根に持っており、言うことを聞かない",
    "ko": "이별로 인해 화가 단단히 났습니다. 지시에 따르지 않을 것입니다.",
    "nl": "Boos na de scheiding. Gehoorzaamt geen werkopdrachten meer.",
    "pt-BR": "Sentirá raiva após o divórcio. Não quer saber de seguir ordens.",
    "ru": "Последователь тяжело переживает развод, поэтому не слушает приказов.",
    "tr": "Boşanmadan dolayı sinirli. Emirlere uymaz.",
    "zh-CN": "离婚后变得易怒，不会听从命令。",
    "zh-TW": "離婚後變得易怒，不會聽從命令。"
  },
  "exclusiveWith": null,
  "groups": [
    "majorDlc",
    "excludedFromMating"
  ],
  "icon": "icons/traits/JiltedLover.png",
  "id": "JiltedLover",
  "name": {
    "ar": "الحبيب المرفوض",
    "de": "Verlassener Liebhaber",
    "en": "Jilted Lover",
    "es": "Calabacero",
    "fr": "Amour éconduit",
    "fr-CA": "Amour éconduit",
    "it": "Separazione",
    "ja": "捨てられた恋人",
    "ko": "실연",
    "nl": "Gekwetste geliefde",
    "pt-BR": "Coração Ferido",
    "ru": "Обида",
    "tr": "Terk Edilmiş Âşık",
    "zh-CN": "怨偶",
    "zh-TW": "怨偶"
  },
  "namePlain": {
    "ar": "الحبيب المرفوض",
    "de": "Verlassener Liebhaber",
    "en": "Jilted Lover",
    "es": "Calabacero",
    "fr": "Amour éconduit",
    "fr-CA": "Amour éconduit",
    "it": "Separazione",
    "ja": "捨てられた恋人",
    "ko": "실연",
    "nl": "Gekwetste geliefde",
    "pt-BR": "Coração Ferido",
    "ru": "Обида",
    "tr": "Terk Edilmiş Âşık",
    "zh-CN": "怨偶",
    "zh-TW": "怨偶"
  },
  "positive": false,
  "thumb": "icons/traits/64/JiltedLover.png"
}
