{
  "description": {
    "ar": "فرصة أكبر لإثارة المتاعب في حالة التشوش.",
    "de": "Der Anhänger neigt eher zu liederlichem Verhalten, wenn er duselig ist.",
    "en": "More likely to engage in debaucherous behaviour when Befuddled.",
    "es": "Puede que pierda los papeles cuando está mareadillo.",
    "fr": "Plus de chances de se livrer à des débauches lorsque cet adepte est confus.",
    "fr-CA": "Plus de chances de se livrer à des débauches lorsque cet adepte est confus.",
    "it": "Ha più possibilità di abbandonarsi a comportamenti dissoluti quando sotto stordimento.",
    "ja": "混乱状態になった時、トラブルを起こしやすい",
    "ko": "심신미약에 빠졌을 때 방탕한 행동을 할 확률이 높습니다.",
    "nl": "Meer kans om losbandig gedrag te vertonen na bedwelmd te zijn.",
    "pt-BR": "Maior probabilidade de ter comportamento inapropriado em Hiperidratação.",
    "ru": "Последователь с большей вероятностью бесчинствует, когда сконфужен.",
    "tr": "Sersemlemiş hâldeyken hovardalık yapma ihtimali daha yüksektir.",
    "zh-CN": "神智不清时，较容易失控闹事。",
    "zh-TW": "神智不清時，較容易失控鬧事。"
  },
  "descriptionPlain": {
    "ar": "فرصة أكبر لإثارة المتاعب في حالة التشوش.",
    "de": "Der Anhänger neigt eher zu liederlichem Verhalten, wenn er duselig ist.",
    "en": "More likely to engage in debaucherous behaviour when Befuddled.",
    "es": "Puede que pierda los papeles cuando está mareadillo.",
    "fr": "Plus de chances de se livrer à des débauches lorsque cet adepte est confus.",
    "fr-CA": "Plus de chances de se livrer à des débauches lorsque cet adepte est confus.",
    "it": "Ha più possibilità di abbandonarsi a comportamenti dissoluti quando sotto stordimento.",
    "ja": "混乱状態になった時、トラブルを起こしやすい",
    "ko": "심신미약에 빠졌을 때 방탕한 행동을 할 확률이 높습니다.",
    "nl": "Meer kans om losbandig gedrag te vertonen na bedwelmd te zijn.",
    "pt-BR": "Maior probabilidade de ter comportamento inapropriado em Hiperidratação.",
    "ru": "Последователь с большей вероятностью бесчинствует, когда сконфужен.",
    "tr": "Sersemlemiş hâldeyken hovardalık yapma ihtimali daha yüksektir.",
    "zh-CN": "神智不清时，较容易失控闹事。",
    "zh-TW": "神智不清時，較容易失控鬧事。"
  },
  "exclusiveWith": "Heavyweight",
  "groups": [
    "starting",
    "majorDlc"
  ],
  "icon": "icons/traits/Lightweight.png",
  "id": "Lightweight",
  "name": {
    "ar": "سهولة التأثر",
    "de": "Leichtgewicht",
    "en": "Lightweight",
    "es": "Impericia beoda",
    "fr": "Poids plume",
    "fr-CA": "Poids plume",
    "it": "Bassa tolleranza",
    "ja": "小柄",
    "ko": "나쁜 술버릇",
    "nl": "Lichtgewicht",
    "pt-BR": "Fracote",
    "ru": "Легковесность",
    "tr": "Hafif Sıklet",
    "zh-CN": "轻量级",
    "zh-TW": "輕量級"
  },
  "namePlain": {
    "ar": "سهولة التأثر",
    "de": "Leichtgewicht",
    "en": "Lightweight",
    "es": "Impericia beoda",
    "fr": "Poids plume",
    "fr-CA": "Poids plume",
    "it": "Bassa tolleranza",
    "ja": "小柄",
    "ko": "나쁜 술버릇",
    "nl": "Lichtgewicht",
    "pt-BR": "Fracote",
    "ru": "Легковесность",
    "tr": "Hafif Sıklet",
    "zh-CN": "轻量级",
    "zh-TW": "輕量級"
  },
  "positive": false,
  "thumb": "icons/traits/64/Lightweight.png"
}
