{
  "description": {
    "ar": "فرصة للاستسلام لنوم عميق عند التكليف بمهمة بنسبة 90%.",
    "de": "Hat bei Erhalt einer Aufgabe eine Chance von 90 % einzuschlafen.",
    "en": "Has a 90% chance of falling asleep when given a task.",
    "es": "Un 90 % de probabilidad de quedarse sopa cuando le mandas una tarea.",
    "fr": "A 90 % de chances de s'endormir lorsqu'on lui confie une tâche.",
    "fr-CA": "A 90 % de chances de s'endormir lorsqu'on lui confie une tâche.",
    "it": "90% di possibilità che si addormenti quando riceve una mansione.",
    "ja": "作業を割り振られた時、90%の確率で寝てしまう",
    "ko": "일을 시킬 때 90% 확률로 잠에 듭니다.",
    "nl": "Heeft 90% kans om in slaap te vallen wanneer die een taak krijgt.",
    "pt-BR": "Seguidor tem 90% de chance de dormir durante a tarefa.",
    "ru": "Последователь засыпает при получении работы с вероятностью 90%.",
    "tr": "Bir görev verildiğinde %90 ihtimalle uyuyakalır.",
    "zh-CN": "有 90% 的几率在接到工作后睡着。",
    "zh-TW": "有 90% 的機率在接到工作後睡著。"
  },
  "descriptionPlain": {
    "ar": "فرصة للاستسلام لنوم عميق عند التكليف بمهمة بنسبة 90%.",
    "de": "Hat bei Erhalt einer Aufgabe eine Chance von 90 % einzuschlafen.",
    "en": "Has a 90% chance of falling asleep when given a task.",
    "es": "Un 90 % de probabilidad de quedarse sopa cuando le mandas una tarea.",
    "fr": "A 90 % de chances de s'endormir lorsqu'on lui confie une tâche.",
    "fr-CA": "A 90 % de chances de s'endormir lorsqu'on lui confie une tâche.",
    "it": "90% di possibilità che si addormenti quando riceve una mansione.",
    "ja": "作業を割り振られた時、90%の確率で寝てしまう",
    "ko": "일을 시킬 때 90% 확률로 잠에 듭니다.",
    "nl": "Heeft 90% kans om in slaap te vallen wanneer die een taak krijgt.",
    "pt-BR": "Seguidor tem 90% de chance de dormir durante a tarefa.",
    "ru": "Последователь засыпает при получении работы с вероятностью 90%.",
    "tr": "Bir görev verildiğinde %90 ihtimalle uyuyakalır.",
    "zh-CN": "有 90% 的几率在接到工作后睡着。",
    "zh-TW": "有 90% 的機率在接到工作後睡著。"
  },
  "exclusiveWith": "Industrious",
  "groups": [
    "single"
  ],
  "icon": "icons/traits/Drowsy.png",
  "id": "Drowsy",
  "name": {
    "ar": "النعاس",
    "de": "Schläfrig",
    "en": "Drowsy",
    "es": "Somnolencia",
    "fr": "Somnolence",
    "fr-CA": "Somnolence",
    "it": "Sonnolenza",
    "ja": "うとうと",
    "ko": "나른함",
    "nl": "Slaperig",
    "pt-BR": "Sonolento",
    "ru": "Сонливость",
    "tr": "Uyuşuk",
    "zh-CN": "昏昏欲睡",
    "zh-TW": "昏昏欲睡"
  },
  "namePlain": {
    "ar": "النعاس",
    "de": "Schläfrig",
    "en": "Drowsy",
    "es": "Somnolencia",
    "fr": "Somnolence",
    "fr-CA": "Somnolence",
    "it": "Sonnolenza",
    "ja": "うとうと",
    "ko": "나른함",
    "nl": "Slaperig",
    "pt-BR": "Sonolento",
    "ru": "Сонливость",
    "tr": "Uyuşuk",
    "zh-CN": "昏昏欲睡",
    "zh-TW": "昏昏欲睡"
  },
  "positive": false,
  "thumb": "icons/traits/64/Drowsy.png"
}
