{
  "description": {
    "ar": "لن يعارض الفرد الحَمَل.",
    "de": "Wird dem Lamm nicht abtrünnig.",
    "en": "Will not dissent against the Lamb.",
    "es": "No se rebelará contra el Cordero.",
    "fr": "Ne se rebellera pas contre l'Agneau.",
    "fr-CA": "Ne se rebellera pas contre l'Agneau.",
    "it": "Non dissentirà contro di te.",
    "ja": "子羊に離反しない",
    "ko": "어린 양에게 반기를 들지 않을 것입니다.",
    "nl": "Zal niet ketteren tegen het Lam.",
    "pt-BR": "Não se rebelará contra o Cordeiro.",
    "ru": "Последователь не подвержен инакомыслию.",
    "tr": "Kuzu'ya başkaldırmaz.",
    "zh-CN": "不会反对圣羊。",
    "zh-TW": "不會反對聖羊。"
  },
  "descriptionPlain": {
    "ar": "لن يعارض الفرد الحَمَل.",
    "de": "Wird dem Lamm nicht abtrünnig.",
    "en": "Will not dissent against the Lamb.",
    "es": "No se rebelará contra el Cordero.",
    "fr": "Ne se rebellera pas contre l'Agneau.",
    "fr-CA": "Ne se rebellera pas contre l'Agneau.",
    "it": "Non dissentirà contro di te.",
    "ja": "子羊に離反しない",
    "ko": "어린 양에게 반기를 들지 않을 것입니다.",
    "nl": "Zal niet ketteren tegen het Lam.",
    "pt-BR": "Não se rebelará contra o Cordeiro.",
    "ru": "Последователь не подвержен инакомыслию.",
    "tr": "Kuzu'ya başkaldırmaz.",
    "zh-CN": "不会反对圣羊。",
    "zh-TW": "不會反對聖羊。"
  },
  "exclusiveWith": null,
  "groups": [
    "good",
    "unique",
    "excludedFromMating"
  ],
  "icon": "icons/traits/BishopOfCult.png",
  "id": "BishopOfCult",
  "name": {
    "ar": "كاهن <color=#FFD201>{0}</color>",
    "de": "Bischof von <color=#FFD201>{0}</color>",
    "en": "Bishop of <color=#FFD201>{0}</color>",
    "es": "Obispo de <color=#FFD201>{0}</color>",
    "fr": "Prélat de <color=#FFD201>{0}</color>",
    "fr-CA": "Prélat de <color=#FFD201>{0}</color>",
    "it": "Custode di: <color=#FFD201>{0}</color>",
    "ja": "<color=#FFD201>{0}</color>の司教",
    "ko": "<color=#FFD201>{0}</color>의 주교",
    "nl": "Bisschop van <color=#FFD201>{0}</color>",
    "pt-BR": "Bispo de <color=#FFD201>{0}</color>",
    "ru": "Епископ поселения",
    "tr": "<color=#FFD201>{0}</color> Rahibi",
    "zh-CN": "<color=#FFD201>{0}</color>之主教",
    "zh-TW": "<color=#FFD201>{0}</color>之主教"
  },
  "namePlain": {
    "ar": "كاهن {0}",
    "de": "Bischof von {0}",
    "en": "Bishop of {0}",
    "es": "Obispo de {0}",
    "fr": "Prélat de {0}",
    "fr-CA": "Prélat de {0}",
    "it": "Custode di: {0}",
    "ja": "{0}の司教",
    "ko": "{0}의 주교",
    "nl": "Bisschop van {0}",
    "pt-BR": "Bispo de {0}",
    "ru": "Епископ поселения",
    "tr": "{0} Rahibi",
    "zh-CN": "{0}之主教",
    "zh-TW": "{0}之主教"
  },
  "positive": true,
  "thumb": "icons/traits/64/BishopOfCult.png"
}
