{
  "description": {
    "ar": "يتشاجر الفرد مع الأزواج الآخرين.",
    "de": "Gerät mit anderen Ehepartnern in Streit.",
    "en": "Will get into fights with other spouses.",
    "es": "Se liará a tortas con otros cónyuges.",
    "fr": "Se battra contre les autres partenaires.",
    "fr-CA": "Se battra contre les autres partenaires.",
    "it": "Litigherà con gli altri membri del Culto che sposi.",
    "ja": "ほかの配偶者とケンカする",
    "ko": "배우자와 싸울 수 있습니다.",
    "nl": "Begint gevechten met andere eega's.",
    "pt-BR": "Vai brigar com outros cônjuges.",
    "ru": "Последователь вступает в драки с другими супругами.",
    "tr": "Diğer eşlerle kavgaya tutuşur.",
    "zh-CN": "会与其他配偶发生打斗。",
    "zh-TW": "會與其他配偶發生打鬥。"
  },
  "descriptionPlain": {
    "ar": "يتشاجر الفرد مع الأزواج الآخرين.",
    "de": "Gerät mit anderen Ehepartnern in Streit.",
    "en": "Will get into fights with other spouses.",
    "es": "Se liará a tortas con otros cónyuges.",
    "fr": "Se battra contre les autres partenaires.",
    "fr-CA": "Se battra contre les autres partenaires.",
    "it": "Litigherà con gli altri membri del Culto che sposi.",
    "ja": "ほかの配偶者とケンカする",
    "ko": "배우자와 싸울 수 있습니다.",
    "nl": "Begint gevechten met andere eega's.",
    "pt-BR": "Vai brigar com outros cônjuges.",
    "ru": "Последователь вступает в драки с другими супругами.",
    "tr": "Diğer eşlerle kavgaya tutuşur.",
    "zh-CN": "会与其他配偶发生打斗。",
    "zh-TW": "會與其他配偶發生打鬥。"
  },
  "exclusiveWith": null,
  "groups": [
    "excludedFromMating"
  ],
  "icon": "icons/traits/MarriedJealous.png",
  "id": "MarriedJealous",
  "name": {
    "ar": "الزوج الغيور",
    "de": "Eifersüchtiger Ehepartner",
    "en": "Jealous Spouse",
    "es": "Cónyuge celoso",
    "fr": "Jalousie maritale",
    "fr-CA": "Jalousie maritale",
    "it": "Gelosia",
    "ja": "嫉妬深い配偶者",
    "ko": "시기하는 배우자",
    "nl": "Jaloerse eega",
    "pt-BR": "Ciúmes",
    "ru": "Ревнивость",
    "tr": "Kıskanç Eş",
    "zh-CN": "善妒配偶",
    "zh-TW": "善妒配偶"
  },
  "namePlain": {
    "ar": "الزوج الغيور",
    "de": "Eifersüchtiger Ehepartner",
    "en": "Jealous Spouse",
    "es": "Cónyuge celoso",
    "fr": "Jalousie maritale",
    "fr-CA": "Jalousie maritale",
    "it": "Gelosia",
    "ja": "嫉妬深い配偶者",
    "ko": "시기하는 배우자",
    "nl": "Jaloerse eega",
    "pt-BR": "Ciúmes",
    "ru": "Ревнивость",
    "tr": "Kıskanç Eş",
    "zh-CN": "善妒配偶",
    "zh-TW": "善妒配偶"
  },
  "positive": false,
  "thumb": "icons/traits/64/MarriedJealous.png"
}
