{
  "description": {
    "ar": "فرصة نجاح أكبر في خيمة التزاوج بنسبة 20%.",
    "de": "20 % höhere Erfolgschancen im Paarungszelt.",
    "en": "20% more likely to be successful in the Mating Tent.",
    "es": "Un 20 % más de probabilidad de salir triunfante del refugio del revolcón.",
    "fr": "20 % de chances supplémentaires de réussir l'accouplement dans la tente.",
    "fr-CA": "20 % de chances supplémentaires de réussir l'accouplement dans la tente.",
    "it": "20% di possibilità in più che abbia successo nella Tenda della fecondazione.",
    "ja": "子作りテントでの成功率が20%上昇する",
    "ko": "짝짓기 텐트에서 성공할 확률이 20% 증가합니다.",
    "nl": "20% meer kans op succes in de paringstent.",
    "pt-BR": "Probabilidade 20% maior de ter sucesso na Barraca de Acasalamento.",
    "ru": "Последователь на 20% успешнее спаривается в любовном шатре.",
    "tr": "Aşk Çadırı'nda başarılı olma ihtimali %20 artar.",
    "zh-CN": "进入交配帐篷后成功的几率增加 20%。",
    "zh-TW": "進入交配帳篷後成功的機率增加 20%。"
  },
  "descriptionPlain": {
    "ar": "فرصة نجاح أكبر في خيمة التزاوج بنسبة 20%.",
    "de": "20 % höhere Erfolgschancen im Paarungszelt.",
    "en": "20% more likely to be successful in the Mating Tent.",
    "es": "Un 20 % más de probabilidad de salir triunfante del refugio del revolcón.",
    "fr": "20 % de chances supplémentaires de réussir l'accouplement dans la tente.",
    "fr-CA": "20 % de chances supplémentaires de réussir l'accouplement dans la tente.",
    "it": "20% di possibilità in più che abbia successo nella Tenda della fecondazione.",
    "ja": "子作りテントでの成功率が20%上昇する",
    "ko": "짝짓기 텐트에서 성공할 확률이 20% 증가합니다.",
    "nl": "20% meer kans op succes in de paringstent.",
    "pt-BR": "Probabilidade 20% maior de ter sucesso na Barraca de Acasalamento.",
    "ru": "Последователь на 20% успешнее спаривается в любовном шатре.",
    "tr": "Aşk Çadırı'nda başarılı olma ihtimali %20 artar.",
    "zh-CN": "进入交配帐篷后成功的几率增加 20%。",
    "zh-TW": "進入交配帳篷後成功的機率增加 20%。"
  },
  "exclusiveWith": null,
  "groups": [
    "good",
    "excludedFromMating"
  ],
  "icon": "icons/traits/MissionaryExcited.png",
  "id": "MissionaryExcited",
  "name": {
    "ar": "حماس المهمة",
    "de": "Von der Mission begeistert",
    "en": "Excited by Mission",
    "es": "Entusiasmo misionero",
    "fr": "Vigueur de retour de mission",
    "fr-CA": "Vigueur de retour de mission",
    "it": "Libidine da missione",
    "ja": "宣教による興奮",
    "ko": "임무로 인해 흥분함",
    "nl": "Opgewonden door zendingsreis",
    "pt-BR": "Animado pela Missão",
    "ru": "Походная бодрость",
    "tr": "Görev Heyecanı",
    "zh-CN": "传教后觉得兴奋",
    "zh-TW": "傳教後覺得興奮"
  },
  "namePlain": {
    "ar": "حماس المهمة",
    "de": "Von der Mission begeistert",
    "en": "Excited by Mission",
    "es": "Entusiasmo misionero",
    "fr": "Vigueur de retour de mission",
    "fr-CA": "Vigueur de retour de mission",
    "it": "Libidine da missione",
    "ja": "宣教による興奮",
    "ko": "임무로 인해 흥분함",
    "nl": "Opgewonden door zendingsreis",
    "pt-BR": "Animado pela Missão",
    "ru": "Походная бодрость",
    "tr": "Görev Heyecanı",
    "zh-CN": "传教后觉得兴奋",
    "zh-TW": "傳教後覺得興奮"
  },
  "positive": true,
  "thumb": "icons/traits/64/MissionaryExcited.png"
}
