{
  "description": {
    "ar": "سيصطدم الفرد بالأتباع الآخرين.",
    "de": "Läuft in andere Anhänger hinein.",
    "en": "Will bump into other Followers.",
    "es": "Se choca con todo el mundo.",
    "fr": "Se cognera dans les autres adeptes.",
    "fr-CA": "Se cognera dans les autres adeptes.",
    "it": "Sbatterà contro altri membri del Culto.",
    "ja": "他の信者にぶつかる",
    "ko": "겨울이 끝난 후에도 눈사람이 녹지 않습니다.",
    "nl": "Botst tegen andere volgelingen aan.",
    "pt-BR": "Colidirá com outros Seguidores.",
    "ru": "Последователь сталкивается с другими.",
    "tr": "Diğer Takipçilere çarpar.",
    "zh-CN": "会撞到其他教徒。",
    "zh-TW": "會撞上其他教徒。"
  },
  "descriptionPlain": {
    "ar": "سيصطدم الفرد بالأتباع الآخرين.",
    "de": "Läuft in andere Anhänger hinein.",
    "en": "Will bump into other Followers.",
    "es": "Se choca con todo el mundo.",
    "fr": "Se cognera dans les autres adeptes.",
    "fr-CA": "Se cognera dans les autres adeptes.",
    "it": "Sbatterà contro altri membri del Culto.",
    "ja": "他の信者にぶつかる",
    "ko": "겨울이 끝난 후에도 눈사람이 녹지 않습니다.",
    "nl": "Botst tegen andere volgelingen aan.",
    "pt-BR": "Colidirá com outros Seguidores.",
    "ru": "Последователь сталкивается с другими.",
    "tr": "Diğer Takipçilere çarpar.",
    "zh-CN": "会撞到其他教徒。",
    "zh-TW": "會撞上其他教徒。"
  },
  "exclusiveWith": null,
  "groups": [
    "unique",
    "excludedFromMating"
  ],
  "icon": "icons/traits/Blind.png",
  "id": "Blind",
  "name": {
    "ar": "الأعمى",
    "de": "Blind",
    "en": "Blind",
    "es": "Ceguera",
    "fr": "Aveugle",
    "fr-CA": "Aveugle",
    "it": "Cecità",
    "ja": "盲目",
    "ko": "영원서리",
    "nl": "Blind",
    "pt-BR": "Cego",
    "ru": "Слепота",
    "tr": "Kör",
    "zh-CN": "目盲",
    "zh-TW": "盲目"
  },
  "namePlain": {
    "ar": "الأعمى",
    "de": "Blind",
    "en": "Blind",
    "es": "Ceguera",
    "fr": "Aveugle",
    "fr-CA": "Aveugle",
    "it": "Cecità",
    "ja": "盲目",
    "ko": "영원서리",
    "nl": "Blind",
    "pt-BR": "Cego",
    "ru": "Слепота",
    "tr": "Kör",
    "zh-CN": "目盲",
    "zh-TW": "盲目"
  },
  "positive": false,
  "thumb": "icons/traits/64/Blind.png"
}
