{
  "description": {
    "ar": "<sprite name=\"icon_FaithUp\"> لن تحدث خسارة بعد الآن في العقيدة عندما يأكل تابع وجبة عشبية.",
    "de": "<sprite name=\"icon_FaithUp\"> Du verlierst keinen Glauben mehr, wenn ein Anhänger eine Grasmahlzeit isst.",
    "en": "<sprite name=\"icon_FaithUp\"> No longer lose Faith when a follower eats a Grass Meal.",
    "es": "<sprite name=\"icon_FaithUp\"> Ya no se pierde fe cuando un adepto se come un plato de hierba.",
    "fr": "<sprite name=\"icon_FaithUp\"> Ne perd pas de foi en mangeant des plats à base d'herbes.",
    "fr-CA": "<sprite name=\"icon_FaithUp\"> Ne perd pas de foi en mangeant des plats à base d'herbes.",
    "it": "<sprite name=\"icon_FaithUp\"> Non perde Fede quando un membro del Culto consuma un pasto a base d'erba.",
    "ja": "<sprite name=\"icon_FaithUp\"> 雑草料理を食べた際に信仰が減少しない",
    "ko": "<sprite name=\"icon_FaithUp\"> 추종자들이 채소 음식을 먹더라도 신앙을 잃지 않습니다.",
    "nl": "<sprite name=\"icon_FaithUp\"> Verlies niet langer geloof wanneer een volgeling een grasmaaltijd eet.",
    "pt-BR": "<sprite name=\"icon_FaithUp\"> Não perderá Fé quando um Seguidor comer uma Refeição de Mato",
    "ru": "Вы не теряете веру, когда последователь съедает травяной салат.",
    "tr": "<sprite name=\"icon_FaithUp\"> Bir Takipçi Çim Yemeği yediğinde artık İnanç azalmaz.",
    "zh-CN": "<sprite name=\"icon_FaithUp\">教徒食用青草餐时不再损失信仰值",
    "zh-TW": "<sprite name=\"icon_FaithUp\"> 教徒食用青草餐時不再損失信仰值"
  },
  "descriptionPlain": {
    "ar": "لن تحدث خسارة بعد الآن في العقيدة عندما يأكل تابع وجبة عشبية.",
    "de": "Du verlierst keinen Glauben mehr, wenn ein Anhänger eine Grasmahlzeit isst.",
    "en": "No longer lose Faith when a follower eats a Grass Meal.",
    "es": "Ya no se pierde fe cuando un adepto se come un plato de hierba.",
    "fr": "Ne perd pas de foi en mangeant des plats à base d'herbes.",
    "fr-CA": "Ne perd pas de foi en mangeant des plats à base d'herbes.",
    "it": "Non perde Fede quando un membro del Culto consuma un pasto a base d'erba.",
    "ja": "雑草料理を食べた際に信仰が減少しない",
    "ko": "추종자들이 채소 음식을 먹더라도 신앙을 잃지 않습니다.",
    "nl": "Verlies niet langer geloof wanneer een volgeling een grasmaaltijd eet.",
    "pt-BR": "Não perderá Fé quando um Seguidor comer uma Refeição de Mato",
    "ru": "Вы не теряете веру, когда последователь съедает травяной салат.",
    "tr": "Bir Takipçi Çim Yemeği yediğinde artık İnanç azalmaz.",
    "zh-CN": "教徒食用青草餐时不再损失信仰值",
    "zh-TW": "教徒食用青草餐時不再損失信仰值"
  },
  "exclusiveWith": null,
  "groups": [
    "good"
  ],
  "icon": "icons/traits/GrassEater.png",
  "id": "GrassEater",
  "name": {
    "ar": "آكل العشب",
    "de": "Grasfresser",
    "en": "Grass Eater",
    "es": "Herbívoro",
    "fr": "Végétarisme",
    "fr-CA": "Herbivorisme",
    "it": "Mangiaerba",
    "ja": "草食",
    "ko": "채식주의자",
    "nl": "Graseter",
    "pt-BR": "Pastoreio",
    "ru": "Вегетарианство",
    "tr": "Çimsever",
    "zh-CN": "草食者",
    "zh-TW": "草食者"
  },
  "namePlain": {
    "ar": "آكل العشب",
    "de": "Grasfresser",
    "en": "Grass Eater",
    "es": "Herbívoro",
    "fr": "Végétarisme",
    "fr-CA": "Herbivorisme",
    "it": "Mangiaerba",
    "ja": "草食",
    "ko": "채식주의자",
    "nl": "Graseter",
    "pt-BR": "Pastoreio",
    "ru": "Вегетарианство",
    "tr": "Çimsever",
    "zh-CN": "草食者",
    "zh-TW": "草食者"
  },
  "positive": true,
  "thumb": "icons/traits/64/GrassEater.png"
}
