{
  "description": {
    "ar": "كل التفاعلات مع الأتباع الآخرين ستكون إيجابية.",
    "de": "Alle Interaktionen mit anderen Anhängern werden positiv sein.",
    "en": "All interactions with other Followers will be positive.",
    "es": "Todas las interacciones con el resto de adeptos serán positivas.",
    "fr": "Toutes les interactions avec les autres adeptes seront positives.",
    "fr-CA": "Toutes les interactions avec les autres adeptes seront positives.",
    "it": "Tutte le interazioni con gli altri membri del Culto saranno positive.",
    "ja": "ほかの信者とのコミュニケーションが必ずポジティブなものになる",
    "ko": "다른 추종자와의 모든 상호작용이 긍정적으로 변합니다.",
    "nl": "Alle interacties met andere volgelingen zijn positief.",
    "pt-BR": "As interações com outros Seguidores serão positivas.",
    "ru": "Последователь оказывает на других только хорошее влияние.",
    "tr": "Diğer Takipçilerle olan tüm etkileşimleri olumlu olur.",
    "zh-CN": "与其他教徒互动时都将是正向互动。",
    "zh-TW": "與其他教徒都將正向互動。"
  },
  "descriptionPlain": {
    "ar": "كل التفاعلات مع الأتباع الآخرين ستكون إيجابية.",
    "de": "Alle Interaktionen mit anderen Anhängern werden positiv sein.",
    "en": "All interactions with other Followers will be positive.",
    "es": "Todas las interacciones con el resto de adeptos serán positivas.",
    "fr": "Toutes les interactions avec les autres adeptes seront positives.",
    "fr-CA": "Toutes les interactions avec les autres adeptes seront positives.",
    "it": "Tutte le interazioni con gli altri membri del Culto saranno positive.",
    "ja": "ほかの信者とのコミュニケーションが必ずポジティブなものになる",
    "ko": "다른 추종자와의 모든 상호작용이 긍정적으로 변합니다.",
    "nl": "Alle interacties met andere volgelingen zijn positief.",
    "pt-BR": "As interações com outros Seguidores serão positivas.",
    "ru": "Последователь оказывает на других только хорошее влияние.",
    "tr": "Diğer Takipçilerle olan tüm etkileşimleri olumlu olur.",
    "zh-CN": "与其他教徒互动时都将是正向互动。",
    "zh-TW": "與其他教徒都將正向互動。"
  },
  "exclusiveWith": null,
  "groups": [
    "good",
    "excludedFromMating"
  ],
  "icon": "icons/traits/MissionaryInspired.png",
  "id": "MissionaryInspired",
  "name": {
    "ar": "إلهام المهمة",
    "de": "Von der Mission beseelt",
    "en": "Inspired by Mission",
    "es": "Inspiración misionera",
    "fr": "Inspiration de retour de mission",
    "fr-CA": "Inspiration de retour de mission",
    "it": "Grazia da missione",
    "ja": "宣教による刺激",
    "ko": "임무에 감명받음",
    "nl": "Geïnspireerd door zendingsreis",
    "pt-BR": "Inspirado pela Missão",
    "ru": "Походная эйфория",
    "tr": "Görev Aşkı",
    "zh-CN": "传教后受到鼓舞",
    "zh-TW": "傳教後受到鼓舞"
  },
  "namePlain": {
    "ar": "إلهام المهمة",
    "de": "Von der Mission beseelt",
    "en": "Inspired by Mission",
    "es": "Inspiración misionera",
    "fr": "Inspiration de retour de mission",
    "fr-CA": "Inspiration de retour de mission",
    "it": "Grazia da missione",
    "ja": "宣教による刺激",
    "ko": "임무에 감명받음",
    "nl": "Geïnspireerd door zendingsreis",
    "pt-BR": "Inspirado pela Missão",
    "ru": "Походная эйфория",
    "tr": "Görev Aşkı",
    "zh-CN": "传教后受到鼓舞",
    "zh-TW": "傳教後受到鼓舞"
  },
  "positive": true,
  "thumb": "icons/traits/64/MissionaryInspired.png"
}
