{
  "description": {
    "ar": "يتغوط الفرد فحم التعفن.",
    "de": "Der Anhänger produziert Fäulnisbrand-Kot.",
    "en": "Poops Rotburn poops.",
    "es": "Suelta caca petrofacta.",
    "fr": "Défèque du charbon putrescent.",
    "fr-CA": "Défèque du charbon putrescent.",
    "it": "Le sue feci sono di marciolite.",
    "ja": "腐敗石のウンチをする",
    "ko": "눈사람과 싸웁니다",
    "nl": "Poept rotsteenpoep.",
    "pt-BR": "Gera Putrefogo ao fazer cocô.",
    "ru": "Последователь испражняется осколками гнилогара.",
    "tr": "Kakası Çürükateş olur.",
    "zh-CN": "会拉出腐烧便便。",
    "zh-TW": "會拉出腐燃便便。"
  },
  "descriptionPlain": {
    "ar": "يتغوط الفرد فحم التعفن.",
    "de": "Der Anhänger produziert Fäulnisbrand-Kot.",
    "en": "Poops Rotburn poops.",
    "es": "Suelta caca petrofacta.",
    "fr": "Défèque du charbon putrescent.",
    "fr-CA": "Défèque du charbon putrescent.",
    "it": "Le sue feci sono di marciolite.",
    "ja": "腐敗石のウンチをする",
    "ko": "눈사람과 싸웁니다",
    "nl": "Poept rotsteenpoep.",
    "pt-BR": "Gera Putrefogo ao fazer cocô.",
    "ru": "Последователь испражняется осколками гнилогара.",
    "tr": "Kakası Çürükateş olur.",
    "zh-CN": "会拉出腐烧便便。",
    "zh-TW": "會拉出腐燃便便。"
  },
  "exclusiveWith": null,
  "groups": [
    "good",
    "majorDlc",
    "winter"
  ],
  "icon": "icons/traits/RotstonePooper.png",
  "id": "RotstonePooper",
  "name": {
    "ar": "تغوط فحم التعفن",
    "de": "Fäulnisbrand-Kotproduzent",
    "en": "Rotburn Pooper",
    "es": "Caca petrofacta",
    "fr": "Selles putrescentes",
    "fr-CA": "Crottes putrescentes",
    "it": "Feci marciolitiche",
    "ja": "腐敗石ウンチ職人",
    "ko": "눈사람 싫어함",
    "nl": "Rotsteenpoeper",
    "pt-BR": "Cocô Putrefogo",
    "ru": "Источник гнилогара",
    "tr": "Çürükateş Kakalı",
    "zh-CN": "腐烧便便家",
    "zh-TW": "腐燃便便家"
  },
  "namePlain": {
    "ar": "تغوط فحم التعفن",
    "de": "Fäulnisbrand-Kotproduzent",
    "en": "Rotburn Pooper",
    "es": "Caca petrofacta",
    "fr": "Selles putrescentes",
    "fr-CA": "Crottes putrescentes",
    "it": "Feci marciolitiche",
    "ja": "腐敗石ウンチ職人",
    "ko": "눈사람 싫어함",
    "nl": "Rotsteenpoeper",
    "pt-BR": "Cocô Putrefogo",
    "ru": "Источник гнилогара",
    "tr": "Çürükateş Kakalı",
    "zh-CN": "腐烧便便家",
    "zh-TW": "腐燃便便家"
  },
  "positive": true,
  "thumb": "icons/traits/64/RotstonePooper.png"
}
