{
  "description": {
    "ar": "لن يتجمد الفرد في أثناء العواصف الثلجية.",
    "de": "Der Anhänger erfriert nicht bei Schneestürmen.",
    "en": "Will not freeze during blizzards.",
    "es": "No se congela durante las ventiscas.",
    "fr": "N'aura jamais froid durant les blizzards.",
    "fr-CA": "N'aura jamais froid durant les tempêtes de neige.",
    "it": "Non congelerà durante le bufere.",
    "ja": "吹雪でも凍結状態にならない",
    "ko": "눈보라 속에서 빙결 상태에 걸리지 않습니다.",
    "nl": "Bevriest niet tijdens sneeuwstormen.",
    "pt-BR": "Não congelará durante as nevascas.",
    "ru": "Последователь не замерзает во время метелей.",
    "tr": "Tipi sırasında donmaz.",
    "zh-CN": "暴风雪期间不会受冻。",
    "zh-TW": "暴風雪期間不會受凍。"
  },
  "descriptionPlain": {
    "ar": "لن يتجمد الفرد في أثناء العواصف الثلجية.",
    "de": "Der Anhänger erfriert nicht bei Schneestürmen.",
    "en": "Will not freeze during blizzards.",
    "es": "No se congela durante las ventiscas.",
    "fr": "N'aura jamais froid durant les blizzards.",
    "fr-CA": "N'aura jamais froid durant les tempêtes de neige.",
    "it": "Non congelerà durante le bufere.",
    "ja": "吹雪でも凍結状態にならない",
    "ko": "눈보라 속에서 빙결 상태에 걸리지 않습니다.",
    "nl": "Bevriest niet tijdens sneeuwstormen.",
    "pt-BR": "Não congelará durante as nevascas.",
    "ru": "Последователь не замерзает во время метелей.",
    "tr": "Tipi sırasında donmaz.",
    "zh-CN": "暴风雪期间不会受冻。",
    "zh-TW": "暴風雪期間不會受凍。"
  },
  "exclusiveWith": null,
  "groups": [
    "good",
    "majorDlc"
  ],
  "icon": "icons/traits/ColdEnthusiast.png",
  "id": "ColdEnthusiast",
  "name": {
    "ar": "قوة التحمل",
    "de": "Dickhäuter",
    "en": "Thick Skinned",
    "es": "Piel férrea",
    "fr": "Peau épaisse",
    "fr-CA": "Couenne épaisse",
    "it": "Pelle spessa",
    "ja": "厚皮",
    "ko": "두꺼운 가죽",
    "nl": "Dikke huid",
    "pt-BR": "Casca Grossa",
    "ru": "Закалённость",
    "tr": "Soğuğa Dirençli",
    "zh-CN": "皮糙",
    "zh-TW": "厚皮膚"
  },
  "namePlain": {
    "ar": "قوة التحمل",
    "de": "Dickhäuter",
    "en": "Thick Skinned",
    "es": "Piel férrea",
    "fr": "Peau épaisse",
    "fr-CA": "Couenne épaisse",
    "it": "Pelle spessa",
    "ja": "厚皮",
    "ko": "두꺼운 가죽",
    "nl": "Dikke huid",
    "pt-BR": "Casca Grossa",
    "ru": "Закалённость",
    "tr": "Soğuğa Dirençli",
    "zh-CN": "皮糙",
    "zh-TW": "厚皮膚"
  },
  "positive": true,
  "thumb": "icons/traits/64/ColdEnthusiast.png"
}
