{
  "description": {
    "ar": "لا يُصاب الفرد بالغيرة إن كان للحَمَل أكثر من زوج.",
    "de": "Wird nicht eifersüchtig, wenn das Lamm mehr als einen Ehepartner hat.",
    "en": "Does not get jealous if the Lamb has more than 1 spouse.",
    "es": "Que el Cordero tenga más cónyuges no le da celos.",
    "fr": "Ne développe pas de jalousie si l'Agneau se marie avec plusieurs partenaires.",
    "fr-CA": "Ne développe pas de jalousie si l'Agneau se marie avec plusieurs partenaires.",
    "it": "Non si ingelosisce se sposi più di un membro del Culto.",
    "ja": "ほかに子羊の配偶者がいても嫉妬しない",
    "ko": "어린 양이 배우자를 하나 이상 두어도 질투하지 않습니다.",
    "nl": "Wordt niet jaloers als het Lam meer dan 1 eega heeft.",
    "pt-BR": "Não sente ciúme de o Cordeiro ter mais de 1 cônjuge.",
    "ru": "Последователь не ревнует ягнёнка к другим супругам.",
    "tr": "Kuzu'nun birden fazla eşi olduğunda kıskanmaz.",
    "zh-CN": "圣羊的配偶超过 1 位时，不会嫉妒。",
    "zh-TW": "聖羊的配偶超過 1 位時，不會嫉妒。"
  },
  "descriptionPlain": {
    "ar": "لا يُصاب الفرد بالغيرة إن كان للحَمَل أكثر من زوج.",
    "de": "Wird nicht eifersüchtig, wenn das Lamm mehr als einen Ehepartner hat.",
    "en": "Does not get jealous if the Lamb has more than 1 spouse.",
    "es": "Que el Cordero tenga más cónyuges no le da celos.",
    "fr": "Ne développe pas de jalousie si l'Agneau se marie avec plusieurs partenaires.",
    "fr-CA": "Ne développe pas de jalousie si l'Agneau se marie avec plusieurs partenaires.",
    "it": "Non si ingelosisce se sposi più di un membro del Culto.",
    "ja": "ほかに子羊の配偶者がいても嫉妬しない",
    "ko": "어린 양이 배우자를 하나 이상 두어도 질투하지 않습니다.",
    "nl": "Wordt niet jaloers als het Lam meer dan 1 eega heeft.",
    "pt-BR": "Não sente ciúme de o Cordeiro ter mais de 1 cônjuge.",
    "ru": "Последователь не ревнует ягнёнка к другим супругам.",
    "tr": "Kuzu'nun birden fazla eşi olduğunda kıskanmaz.",
    "zh-CN": "圣羊的配偶超过 1 位时，不会嫉妒。",
    "zh-TW": "聖羊的配偶超過 1 位時，不會嫉妒。"
  },
  "exclusiveWith": null,
  "groups": [
    "starting",
    "faithful",
    "good"
  ],
  "icon": "icons/traits/Polyamory.png",
  "id": "Polyamory",
  "name": {
    "ar": "متعدد العلاقات",
    "de": "Polyamourös",
    "en": "Polyamorous",
    "es": "Poliamor",
    "fr": "Polyamour",
    "fr-CA": "Polyamour",
    "it": "Poliamore",
    "ja": "ポリアモラス",
    "ko": "다자 연애",
    "nl": "Polyamoreus",
    "pt-BR": "Poliamor",
    "ru": "Полиамория",
    "tr": "Çok Eşli",
    "zh-CN": "开放关系",
    "zh-TW": "多邊戀"
  },
  "namePlain": {
    "ar": "متعدد العلاقات",
    "de": "Polyamourös",
    "en": "Polyamorous",
    "es": "Poliamor",
    "fr": "Polyamour",
    "fr-CA": "Polyamour",
    "it": "Poliamore",
    "ja": "ポリアモラス",
    "ko": "다자 연애",
    "nl": "Polyamoreus",
    "pt-BR": "Poliamor",
    "ru": "Полиамория",
    "tr": "Çok Eşli",
    "zh-CN": "开放关系",
    "zh-TW": "多邊戀"
  },
  "positive": true,
  "thumb": "icons/traits/64/Polyamory.png"
}
