{
  "description": {
    "ar": "أكثر عرضة للتجمد.",
    "de": "Der Anhänger erfriert mit höherer Wahrscheinlichkeit.",
    "en": "More likely to freeze.",
    "es": "Es muy probable que se congele.",
    "fr": "Plus de chances d'avoir froid.",
    "fr-CA": "Plus de chances d'avoir froid.",
    "it": "Tende a congelarsi.",
    "ja": "凍結状態になりやすい",
    "ko": "빙결될 가능성이 더 높습니다.",
    "nl": "Grotere kans om te bevriezen.",
    "pt-BR": "Há maior probabilidade de congelar.",
    "ru": "Последователь замерзает с большей вероятностью.",
    "tr": "Donma ihtimali daha yüksektir.",
    "zh-CN": "更容易受冻。",
    "zh-TW": "更容易受凍。"
  },
  "descriptionPlain": {
    "ar": "أكثر عرضة للتجمد.",
    "de": "Der Anhänger erfriert mit höherer Wahrscheinlichkeit.",
    "en": "More likely to freeze.",
    "es": "Es muy probable que se congele.",
    "fr": "Plus de chances d'avoir froid.",
    "fr-CA": "Plus de chances d'avoir froid.",
    "it": "Tende a congelarsi.",
    "ja": "凍結状態になりやすい",
    "ko": "빙결될 가능성이 더 높습니다.",
    "nl": "Grotere kans om te bevriezen.",
    "pt-BR": "Há maior probabilidade de congelar.",
    "ru": "Последователь замерзает с большей вероятностью.",
    "tr": "Donma ihtimali daha yüksektir.",
    "zh-CN": "更容易受冻。",
    "zh-TW": "更容易受凍。"
  },
  "exclusiveWith": "WarmBlooded",
  "groups": [
    "rareStarting",
    "majorDlc"
  ],
  "icon": "icons/traits/ColdBlooded.png",
  "id": "ColdBlooded",
  "name": {
    "ar": "الدم البارد",
    "de": "Kaltblüter",
    "en": "Cold Blooded",
    "es": "Sangre fría",
    "fr": "Sang froid",
    "fr-CA": "Sang froid",
    "it": "Sangue freddo",
    "ja": "冷血",
    "ko": "냉혈",
    "nl": "Koudbloedig",
    "pt-BR": "Sangue Frio",
    "ru": "Склонность к замерзанию",
    "tr": "Soğukkanlı",
    "zh-CN": "冷血",
    "zh-TW": "冷血"
  },
  "namePlain": {
    "ar": "الدم البارد",
    "de": "Kaltblüter",
    "en": "Cold Blooded",
    "es": "Sangre fría",
    "fr": "Sang froid",
    "fr-CA": "Sang froid",
    "it": "Sangue freddo",
    "ja": "冷血",
    "ko": "냉혈",
    "nl": "Koudbloedig",
    "pt-BR": "Sangue Frio",
    "ru": "Склонность к замерзанию",
    "tr": "Soğukkanlı",
    "zh-CN": "冷血",
    "zh-TW": "冷血"
  },
  "positive": false,
  "thumb": "icons/traits/64/ColdBlooded.png"
}
