{
  "description": {
    "ar": "فرصة أكبر لأن يُضرب الفرد بصاعقة. لن يموت عندما يُصعق.",
    "de": "Der Anhänger hat eine höhere Chance, vom Blitz getroffen zu werden. Er stirbt nicht, wenn er getroffen wird.",
    "en": "Higher chance of being struck by lightning. Won't die when struck.",
    "es": "Tiene todas las papeletas para que le caiga un rayo, aunque sobrevive.",
    "fr": "L'adepte a plus de chances d'être frappé par la foudre, mais cela ne le tue pas.",
    "fr-CA": "L'adepte a plus de chances d'être frappé par la foudre, mais cela ne le tue pas.",
    "it": "Ha più possibilità di beccarsi un fulmine, ma non morirà.",
    "ja": "雷に打たれる確率が高いが、雷に打たれても死なない",
    "ko": "번개를 맞을 확률이 더 높습니다. 그걸로 죽지는 않습니다.",
    "nl": "Grotere kans om door bliksem getroffen te worden. Gaat niet dood door bliksem.",
    "pt-BR": "Maior probabilidade de atrair raios, mas não morrerá quando atingido.",
    "ru": "Последователь с большей вероятностью получает удары молнии, хотя и не умирает от них.",
    "tr": "Üstüne yıldırım düşme ihtimali daha yüksektir. Yıldırımdan ölmez.",
    "zh-CN": "被闪电击中的几率更高，但被击中不会死亡。",
    "zh-TW": "被閃電擊中機率更高，但被擊中不會死亡。"
  },
  "descriptionPlain": {
    "ar": "فرصة أكبر لأن يُضرب الفرد بصاعقة. لن يموت عندما يُصعق.",
    "de": "Der Anhänger hat eine höhere Chance, vom Blitz getroffen zu werden. Er stirbt nicht, wenn er getroffen wird.",
    "en": "Higher chance of being struck by lightning. Won't die when struck.",
    "es": "Tiene todas las papeletas para que le caiga un rayo, aunque sobrevive.",
    "fr": "L'adepte a plus de chances d'être frappé par la foudre, mais cela ne le tue pas.",
    "fr-CA": "L'adepte a plus de chances d'être frappé par la foudre, mais cela ne le tue pas.",
    "it": "Ha più possibilità di beccarsi un fulmine, ma non morirà.",
    "ja": "雷に打たれる確率が高いが、雷に打たれても死なない",
    "ko": "번개를 맞을 확률이 더 높습니다. 그걸로 죽지는 않습니다.",
    "nl": "Grotere kans om door bliksem getroffen te worden. Gaat niet dood door bliksem.",
    "pt-BR": "Maior probabilidade de atrair raios, mas não morrerá quando atingido.",
    "ru": "Последователь с большей вероятностью получает удары молнии, хотя и не умирает от них.",
    "tr": "Üstüne yıldırım düşme ihtimali daha yüksektir. Yıldırımdan ölmez.",
    "zh-CN": "被闪电击中的几率更高，但被击中不会死亡。",
    "zh-TW": "被閃電擊中機率更高，但被擊中不會死亡。"
  },
  "exclusiveWith": null,
  "groups": [
    "starting",
    "good",
    "majorDlc",
    "winter"
  ],
  "icon": "icons/traits/LightningEnthusiast.png",
  "id": "LightningEnthusiast",
  "name": {
    "ar": "موصل",
    "de": "Leitfähig",
    "en": "Conductive",
    "es": "Conductor",
    "fr": "Corps conducteur",
    "fr-CA": "Corps conducteur",
    "it": "Conduttività",
    "ja": "導電体質",
    "ko": "벼락 맞을 놈",
    "nl": "Geleidend",
    "pt-BR": "Condutividade",
    "ru": "Электропроводность",
    "tr": "İletken",
    "zh-CN": "导电",
    "zh-TW": "導電"
  },
  "namePlain": {
    "ar": "موصل",
    "de": "Leitfähig",
    "en": "Conductive",
    "es": "Conductor",
    "fr": "Corps conducteur",
    "fr-CA": "Corps conducteur",
    "it": "Conduttività",
    "ja": "導電体質",
    "ko": "벼락 맞을 놈",
    "nl": "Geleidend",
    "pt-BR": "Condutividade",
    "ru": "Электропроводность",
    "tr": "İletken",
    "zh-CN": "导电",
    "zh-TW": "導電"
  },
  "positive": true,
  "thumb": "icons/traits/64/LightningEnthusiast.png"
}
